### ISSUE TITLE
Verdict events doubling

### ISSUE THREAD

**Issue by voatsap** [cilium/hubble#641]
Dear Hubble community,

While logging traffic with Hubble: 
```
hubble observe -f --server hubble-relay:80 -o json --tcp-flags ACK --not --tcp-flags SYN
```

Getting most events doubled in output:
They have only difference in logging timestamp, ex:
```
{"time":"2021-10-18T10:33:29.416912427Z","verdict":"FORWARDED","ethernet":{"source":"aa:02:51:65:11:83","destination":"d6:da:f1:62:10:d5"},"IP":{"source":"22.26.54.134","destination":"10.0.0.171","ipVersion":"IPv4"},"l4":{"TCP":{"source_port":443,"destination_port":36836,"flags":{"SYN":true,"ACK":true}}},"source":{"identity":2,"labels":["reserved:world"]},"destination":{"ID":1308,"identity":5886,"namespace":"cattle-system","labels":["k8s:app=cattle-cluster-agent","k8s:io.cilium.k8s.namespace.labels.field.cattle.io/projectId=p-8xjww","k8s:io.cilium.k8s.policy.cluster=default","k8s:io.cilium.k8s.policy.serviceaccount=cattle","k8s:io.kubernetes.pod.namespace=cattle-system"],"pod_name":"cattle-cluster-agent-6dc4fcfc7f-wmcxz"},"Type":"L3_L4","node_name":"dev-controlplain1","reply":true,"event_type":{"type":4},"traffic_direction":"EGRESS","trace_observation_point":"TO_ENDPOINT","is_reply":true,"interface":{"index":43,"name":"lxcddb869735f50"},"Summary":"TCP Flags: SYN, ACK"}
{"time":"2021-10-18T10:33:29.473582998Z","verdict":"FORWARDED","ethernet":{"source":"aa:02:51:65:11:83","destination":"d6:da:f1:62:10:d5"},"IP":{"source":"22.26.54.134","destination":"10.0.0.171","ipVersion":"IPv4"},"l4":{"TCP":{"source_port":443,"destination_port":36838,"flags":{"SYN":true,"ACK":true}}},"source":{"identity":2,"labels":["reserved:world"]},"destination":{"ID":1308,"identity":5886,"namespace":"cattle-system","labels":["k8s:app=cattle-cluster-agent","k8s:io.cilium.k8s.namespace.labels.field.cattle.io/projectId=p-8xjww","k8s:io.cilium.k8s.policy.cluster=default","k8s:io.cilium.k8s.policy.serviceaccount=cattle","k8s:io.kubernetes.pod.namespace=cattle-system"],"pod_name":"cattle-cluster-agent-6dc4fcfc7f-wmcxz"},"Type":"L3_L4","node_name":"dev-controlplain1","reply":true,"event_type":{"type":4},"traffic_direction":"EGRESS","trace_observation_point":"TO_ENDPOINT","is_reply":true,"interface":{"index":43,"name":"lxcddb869735f50"},"Summary":"TCP Flags: SYN, ACK"}


{"time":"2021-10-18T10:35:35.381328980Z","verdict":"FORWARDED","ethernet":{"source":"d6:da:f1:62:10:d5","destination":"aa:02:51:65:11:83"},"IP":{"source":"10.0.0.171","destination":"10.45.80.193","ipVersion":"IPv4"},"l4":{"TCP":{"source_port":60680,"destination_port":6443,"flags":{"ACK":true}}},"source":{"ID":1308,"identity":5886,"namespace":"cattle-system","labels":["k8s:app=cattle-cluster-agent","k8s:io.cilium.k8s.namespace.labels.field.cattle.io/projectId=p-8xjww","k8s:io.cilium.k8s.policy.cluster=default","k8s:io.cilium.k8s.policy.serviceaccount=cattle","k8s:io.kubernetes.pod.namespace=cattle-system"],"pod_name":"cattle-cluster-agent-6dc4fcfc7f-wmcxz"},"destination":{"identity":1,"labels":["reserved:host"]},"Type":"L3_L4","node_name":"dev-controlplain1","event_type":{"type":4,"sub_type":3},"traffic_direction":"EGRESS","trace_observation_point":"TO_STACK","is_reply":false,"Summary":"TCP Flags: ACK"}
{"time":"2021-10-18T10:35:35.381347176Z","verdict":"FORWARDED","ethernet":{"source":"d6:da:f1:62:10:d5","destination":"aa:02:51:65:11:83"},"IP":{"source":"10.0.0.171","destination":"10.45.80.193","ipVersion":"IPv4"},"l4":{"TCP":{"source_port":55512,"destination_port":6443,"flags":{"ACK":true}}},"source":{"ID":1308,"identity":5886,"namespace":"cattle-system","labels":["k8s:app=cattle-cluster-agent","k8s:io.cilium.k8s.namespace.labels.field.cattle.io/projectId=p-8xjww","k8s:io.cilium.k8s.policy.cluster=default","k8s:io.cilium.k8s.policy.serviceaccount=cattle","k8s:io.kubernetes.pod.namespace=cattle-system"],"pod_name":"cattle-cluster-agent-6dc4fcfc7f-wmcxz"},"destination":{"identity":1,"labels":["reserved:host"]},"Type":"L3_L4","node_name":"dev-controlplain1","event_type":{"type":4,"sub_type":3},"traffic_direction":"EGRESS","trace_observation_point":"TO_STACK","is_reply":false,"Summary":"TCP Flags: ACK"}
```

How this could be explained and avoided? Thanks!

**Comment by voatsap** [comment]
@gandro sorry, update with correct one:
```
{"time":"2021-10-18T11:30:20.830417817Z","verdict":"FORWARDED","ethernet":{"source":"66:54:11:3e:bd:de","destination":"12:7a:c7:e0:b1:28"},"IP":{"source":"10.0.2.75","destination":"10.45.80.193","ipVersion":"IPv4"},"l4":{"TCP":{"source_port":49488,"destination_port":6443,"flags":{"ACK":true}}},"source":{"ID":140,"identity":6013,"namespace":"ingress-nginx","labels":["k8s:app.kubernetes.io/component=controller","k8s:app.kubernetes.io/instance=ingress-nginx","k8s:app.kubernetes.io/name=ingress-nginx","k8s:io.cilium.k8s.namespace.labels.field.cattle.io/projectId=p-8xjww","k8s:io.cilium.k8s.namespace.labels.name=ingress-nginx","k8s:io.cilium.k8s.policy.cluster=default","k8s:io.cilium.k8s.policy.serviceaccount=ingress-nginx","k8s:io.kubernetes.pod.namespace=ingress-nginx"],"pod_name":"ingress-nginx-controller-db9d9c7f4-gjllb"},"destination":{"identity":6,"labels":["reserved:remote-node"]},"Type":"L3_L4","node_name":"dev-wg-app1","event_type":{"type":4,"sub_type":3},"traffic_direction":"EGRESS","trace_observation_point":"TO_STACK","is_reply":false,"Summary":"TCP Flags: ACK"}
{"time":"2021-10-18T11:30:26.853421611Z","verdict":"FORWARDED","ethernet":{"source":"66:54:11:3e:bd:de","destination":"12:7a:c7:e0:b1:28"},"IP":{"source":"10.0.2.75","destination":"10.45.80.193","ipVersion":"IPv4"},"l4":{"TCP":{"source_port":49488,"destination_port":6443,"flags":{"ACK":true}}},"source":{"ID":140,"identity":6013,"namespace":"ingress-nginx","labels":["k8s:app.kubernetes.io/component=controller","k8s:app.kubernetes.io/instance=ingress-nginx","k8s:app.kubernetes.io/name=ingress-nginx","k8s:io.cilium.k8s.namespace.labels.field.cattle.io/projectId=p-8xjww","k8s:io.cilium.k8s.namespace.labels.name=ingress-nginx","k8s:io.cilium.k8s.policy.cluster=default","k8s:io.cilium.k8s.policy.serviceaccount=ingress-nginx","k8s:io.kubernetes.pod.namespace=ingress-nginx"],"pod_name":"ingress-nginx-controller-db9d9c7f4-gjllb"},"destination":{"identity":6,"labels":["reserved:remote-node"]},"Type":"L3_L4","node_name":"dev-wg-app1","event_type":{"type":4,"sub_type":3},"traffic_direction":"EGRESS","trace_observation_point":"TO_STACK","is_reply":false,"Summary":"TCP Flags: ACK"}
```

**Comment by voatsap** [comment]
@gando 
I can confirm that I observe same ACK flow on tcpdump.
Regarding aggregation, seemsed its not affecting this since I have got same events within one second

The settings are the same as you mention above

```
{"time":"2021-10-18T13:48:14.451792408Z","verdict":"FORWARDED","ethernet":{"source":"de:7a:f9:c6:68:af","destination":"fa:8e:3b:22:ea:44"},"IP":{"source":"10.0.5.16","destination":"10.0.2.75","ipVersion":"IPv4"},"l4":{"TCP":{"source_port":59582,"destination_port":80,"flags":{"ACK":true}}},"source":{"ID":183,"identity":21347,"namespace":"kube-system","labels":["k8s:io.cilium.k8s.namespace.labels.field.cattle.io/projectId=p-8xjww","k8s:io.cilium.k8s.policy.cluster=default","k8s:io.cilium.k8s.policy.serviceaccount=default","k8s:io.kubernetes.pod.namespace=kube-system","k8s:run=test-shell"],"pod_name":"test-shell"},"destination":{"identity":6013,"namespace":"ingress-nginx","labels":["k8s:app.kubernetes.io/component=controller","k8s:app.kubernetes.io/instance=ingress-nginx","k8s:app.kubernetes.io/name=ingress-nginx","k8s:io.cilium.k8s.namespace.labels.field.cattle.io/projectId=p-8xjww","k8s:io.cilium.k8s.namespace.labels.name=ingress-nginx","k8s:io.cilium.k8s.policy.cluster=default","k8s:io.cilium.k8s.policy.serviceaccount=ingress-nginx","k8s:io.kubernetes.pod.namespace=ingress-nginx"],"pod_name":"ingress-nginx-controller-db9d9c7f4-gjllb"},"Type":"L3_L4","node_name":"dev-wg-app2","event_type":{"type":4,"sub_type":4},"trace_observation_point":"TO_OVERLAY","interface":{"index":7,"name":"cilium_vxlan"},"Summary":"TCP Flags: ACK"}
{"time":"2021-10-18T13:48:14.456493468Z","verdict":"FORWARDED","ethernet":{"source":"de:7a:f9:c6:68:af","destination":"fa:8e:3b:22:ea:44"},"IP":{"source":"10.0.5.16","destination":"10.0.2.75","ipVersion":"IPv4"},"l4":{"TCP":{"source_port":59582,"destination_port":80,"flags":{"ACK":true}}},"source":{"ID":183,"identity":21347,"namespace":"kube-system","labels":["k8s:io.cilium.k8s.namespace.labels.field.cattle.io/projectId=p-8xjww","k8s:io.cilium.k8s.policy.cluster=default","k8s:io.cilium.k8s.policy.serviceaccount=default","k8s:io.kubernetes.pod.namespace=kube-system","k8s:run=test-shell"],"pod_name":"test-shell"},"destination":{"identity":6013,"namespace":"ingress-nginx","labels":["k8s:app.kubernetes.io/component=controller","k8s:app.kubernetes.io/instance=ingress-nginx","k8s:app.kubernetes.io/name=ingress-nginx","k8s:io.cilium.k8s.namespace.labels.field.cattle.io/projectId=p-8xjww","k8s:io.cilium.k8s.namespace.labels.name=ingress-nginx","k8s:io.cilium.k8s.policy.cluster=default","k8s:io.cilium.k8s.policy.serviceaccount=ingress-nginx","k8s:io.kubernetes.pod.namespace=ingress-nginx"],"pod_name":"ingress-nginx-controller-db9d9c7f4-gjllb"},"Type":"L3_L4","node_name":"dev-wg-app2","event_type":{"type":4,"sub_type":4},"trace_observation_point":"TO_OVERLAY","interface":{"index":7,"name":"cilium_vxlan"},"Summary":"TCP Flags: ACK"}

{"time":"2021-10-18T13:48:14.451878590Z","verdict":"FORWARDED","ethernet":{"source":"12:7a:c7:e0:b1:28","destination":"66:54:11:3e:bd:de"},"IP":{"source":"10.0.5.16","destination":"10.0.2.75","ipVersion":"IPv4"},"l4":{"TCP":{"source_port":59582,"destination_port":80,"flags":{"ACK":true}}},"source":{"identity":21347,"namespace":"kube-system","labels":["k8s:io.cilium.k8s.namespace.labels.field.cattle.io/projectId=p-8xjww","k8s:io.cilium.k8s.policy.cluster=default","k8s:io.cilium.k8s.policy.serviceaccount=default","k8s:io.kubernetes.pod.namespace=kube-system","k8s:run=test-shell"],"pod_name":"test-shell"},"destination":{"ID":140,"identity":6013,"namespace":"ingress-nginx","labels":["k8s:app.kubernetes.io/component=controller","k8s:app.kubernetes.io/instance=ingress-nginx","k8s:app.kubernetes.io/name=ingress-nginx","k8s:io.cilium.k8s.namespace.labels.field.cattle.io/projectId=p-8xjww","k8s:io.cilium.k8s.namespace.labels.name=ingress-nginx","k8s:io.cilium.k8s.policy.cluster=default","k8s:io.cilium.k8s.policy.serviceaccount=ingress-nginx","k8s:io.kubernetes.pod.namespace=ingress-nginx"],"pod_name":"ingress-nginx-controller-db9d9c7f4-gjllb"},"Type":"L3_L4","node_name":"dev-wg-app1","event_type":{"type":4},"traffic_direction":"INGRESS","trace_observation_point":"TO_ENDPOINT","is_reply":false,"interface":{"index":13,"name":"lxc402cc03b6a63"},"Summary":"TCP Flags: ACK"}
{"time":"2021-10-18T13:48:14.455632328Z","verdict":"FORWARDED","ethernet":{"source":"12:7a:c7:e0:b1:28","destination":"66:54:11:3e:bd:de"},"IP":{"source":"10.0.5.16","destination":"10.0.2.75","ipVersion":"IPv4"},"l4":{"TCP":{"source_port":59582,"destination_port":80,"flags":{"ACK":true}}},"source":{"identity":21347,"namespace":"kube-system","labels":["k8s:io.cilium.k8s.namespace.labels.field.cattle.io/projectId=p-8xjww","k8s:io.cilium.k8s.policy.cluster=default","k8s:io.cilium.k8s.policy.serviceaccount=default","k8s:io.kubernetes.pod.namespace=kube-system","k8s:run=test-shell"],"pod_name":"test-shell"},"destination":{"ID":140,"identity":6013,"namespace":"ingress-nginx","labels":["k8s:app.kubernetes.io/component=controller","k8s:app.kubernetes.io/instance=ingress-nginx","k8s:app.kubernetes.io/name=ingress-nginx","k8s:io.cilium.k8s.namespace.labels.field.cattle.io/projectId=p-8xjww","k8s:io.cilium.k8s.namespace.labels.name=ingress-nginx","k8s:io.cilium.k8s.policy.cluster=default","k8s:io.cilium.k8s.policy.serviceaccount=ingress-nginx","k8s:io.kubernetes.pod.namespace=ingress-nginx"],"pod_name":"ingress-nginx-controller-db9d9c7f4-gjllb"},"Type":"L3_L4","node_name":"dev-wg-app1","event_type":{"type":4},"traffic_direction":"INGRESS","trace_observation_point":"TO_ENDPOINT","is_reply":false,"interface":{"index":13,"name":"lxc402cc03b6a63"},"Summary":"TCP Flags: ACK"}
```

**Comment by voatsap** [comment]
@gandro 

Regading event flow and aggregations - I can't see any evens because I'm filtering only ACK ones.

I'm curl'ing from Ubuntu pod, the pod form ingress nginx, so request simple:

```
root@test-shell:/# curl 10.43.249.66:80

# flow logger shows two pairs of similar ACK events:
[voa@dev-bastion bog-infra]$ k logs -f cilium-flow-logger-558c54f48f-xwr7c  | grep 10.0.5.16
{"time":"2021-10-18T13:48:14.451792408Z","verdict":"FORWARDED","ethernet":{"source":"de:7a:f9:c6:68:af","destination":"fa:8e:3b:22:ea:44"},"IP":{"source":"10.0.5.16","destination":"10.0.2.75","ipVersion":"IPv4"},"l4":{"TCP":{"source_port":59582,"destination_port":80,"flags":{"ACK":true}}},"source":{"ID":183,"identity":21347,"namespace":"kube-system","labels":["k8s:io.cilium.k8s.namespace.labels.field.cattle.io/projectId=p-8xjww","k8s:io.cilium.k8s.policy.cluster=default","k8s:io.cilium.k8s.policy.serviceaccount=default","k8s:io.kubernetes.pod.namespace=kube-system","k8s:run=test-shell"],"pod_name":"test-shell"},"destination":{"identity":6013,"namespace":"ingress-nginx","labels":["k8s:app.kubernetes.io/component=controller","k8s:app.kubernetes.io/instance=ingress-nginx","k8s:app.kubernetes.io/name=ingress-nginx","k8s:io.cilium.k8s.namespace.labels.field.cattle.io/projectId=p-8xjww","k8s:io.cilium.k8s.namespace.labels.name=ingress-nginx","k8s:io.cilium.k8s.policy.cluster=default","k8s:io.cilium.k8s.policy.serviceaccount=ingress-nginx","k8s:io.kubernetes.pod.namespace=ingress-nginx"],"pod_name":"ingress-nginx-controller-db9d9c7f4-gjllb"},"Type":"L3_L4","node_name":"dev-wg-app2","event_type":{"type":4,"sub_type":4},"trace_observation_point":"TO_OVERLAY","interface":{"index":7,"name":"cilium_vxlan"},"Summary":"TCP Flags: ACK"}
{"time":"2021-10-18T13:48:14.451878590Z","verdict":"FORWARDED","ethernet":{"source":"12:7a:c7:e0:b1:28","destination":"66:54:11:3e:bd:de"},"IP":{"source":"10.0.5.16","destination":"10.0.2.75","ipVersion":"IPv4"},"l4":{"TCP":{"source_port":59582,"destination_port":80,"flags":{"ACK":true}}},"source":{"identity":21347,"namespace":"kube-system","labels":["k8s:io.cilium.k8s.namespace.labels.field.cattle.io/projectId=p-8xjww","k8s:io.cilium.k8s.policy.cluster=default","k8s:io.cilium.k8s.policy.serviceaccount=default","k8s:io.kubernetes.pod.namespace=kube-system","k8s:run=test-shell"],"pod_name":"test-shell"},"destination":{"ID":140,"identity":6013,"namespace":"ingress-nginx","labels":["k8s:app.kubernetes.io/component=controller","k8s:app.kubernetes.io/instance=ingress-nginx","k8s:app.kubernetes.io/name=ingress-nginx","k8s:io.cilium.k8s.namespace.labels.field.cattle.io/projectId=p-8xjww","k8s:io.cilium.k8s.namespace.labels.name=ingress-nginx","k8s:io.cilium.k8s.policy.cluster=default","k8s:io.cilium.k8s.policy.serviceaccount=ingress-nginx","k8s:io.kubernetes.pod.namespace=ingress-nginx"],"pod_name":"ingress-nginx-controller-db9d9c7f4-gjllb"},"Type":"L3_L4","node_name":"dev-wg-app1","event_type":{"type":4},"traffic_direction":"INGRESS","trace_observation_point":"TO_ENDPOINT","is_reply":false,"interface":{"index":13,"name":"lxc402cc03b6a63"},"Summary":"TCP Flags: ACK"}
{"time":"2021-10-18T13:48:14.455632328Z","verdict":"FORWARDED","ethernet":{"source":"12:7a:c7:e0:b1:28","destination":"66:54:11:3e:bd:de"},"IP":{"source":"10.0.5.16","destination":"10.0.2.75","ipVersion":"IPv4"},"l4":{"TCP":{"source_port":59582,"destination_port":80,"flags":{"ACK":true}}},"source":{"identity":21347,"namespace":"kube-system","labels":["k8s:io.cilium.k8s.namespace.labels.field.cattle.io/projectId=p-8xjww","k8s:io.cilium.k8s.policy.cluster=default","k8s:io.cilium.k8s.policy.serviceaccount=default","k8s:io.kubernetes.pod.namespace=kube-system","k8s:run=test-shell"],"pod_name":"test-shell"},"destination":{"ID":140,"identity":6013,"namespace":"ingress-nginx","labels":["k8s:app.kubernetes.io/component=controller","k8s:app.kubernetes.io/instance=ingress-nginx","k8s:app.kubernetes.io/name=ingress-nginx","k8s:io.cilium.k8s.namespace.labels.field.cattle.io/projectId=p-8xjww","k8s:io.cilium.k8s.namespace.labels.name=ingress-nginx","k8s:io.cilium.k8s.policy.cluster=default","k8s:io.cilium.k8s.policy.serviceaccount=ingress-nginx","k8s:io.kubernetes.pod.namespace=ingress-nginx"],"pod_name":"ingress-nginx-controller-db9d9c7f4-gjllb"},"Type":"L3_L4","node_name":"dev-wg-app1","event_type":{"type":4},"traffic_direction":"INGRESS","trace_observation_point":"TO_ENDPOINT","is_reply":false,"interface":{"index":13,"name":"lxc402cc03b6a63"},"Summary":"TCP Flags: ACK"}
{"time":"2021-10-18T13:48:14.456493468Z","verdict":"FORWARDED","ethernet":{"source":"de:7a:f9:c6:68:af","destination":"fa:8e:3b:22:ea:44"},"IP":{"source":"10.0.5.16","destination":"10.0.2.75","ipVersion":"IPv4"},"l4":{"TCP":{"source_port":59582,"destination_port":80,"flags":{"ACK":true}}},"source":{"ID":183,"identity":21347,"namespace":"kube-system","labels":["k8s:io.cilium.k8s.namespace.labels.field.cattle.io/projectId=p-8xjww","k8s:io.cilium.k8s.policy.cluster=default","k8s:io.cilium.k8s.policy.serviceaccount=default","k8s:io.kubernetes.pod.namespace=kube-system","k8s:run=test-shell"],"pod_name":"test-shell"},"destination":{"identity":6013,"namespace":"ingress-nginx","labels":["k8s:app.kubernetes.io/component=controller","k8s:app.kubernetes.io/instance=ingress-nginx","k8s:app.kubernetes.io/name=ingress-nginx","k8s:io.cilium.k8s.namespace.labels.field.cattle.io/projectId=p-8xjww","k8s:io.cilium.k8s.namespace.labels.name=ingress-nginx","k8s:io.cilium.k8s.policy.cluster=default","k8s:io.cilium.k8s.policy.serviceaccount=ingress-nginx","k8s:io.kubernetes.pod.namespace=ingress-nginx"],"pod_name":"ingress-nginx-controller-db9d9c7f4-gjllb"},"Type":"L3_L4","node_name":"dev-wg-app2","event_type":{"type":4,"sub_type":4},"trace_observation_point":"TO_OVERLAY","interface":{"index":7,"name":"cilium_vxlan"},"Summary":"TCP Flags: ACK"}
```

With tcpdump we got same count of ACK events:
```
root@test-shell:/# tcpdump "tcp[tcpflags] & (tcp-ack) != 0"
tcpdump: verbose output suppressed, use -v or -vv for full protocol decode
listening on eth0, link-type EN10MB (Ethernet), capture size 262144 bytes
13:48:14.451689 IP ingress-nginx-controller.ingress-nginx.svc.cluster.local.80 > test-shell.59582: Flags [S.], seq 668788273, ack 1510531071, win 27960, options [mss 1410,sackOK,TS val 244925152 ecr 1758652019,nop,wscale 7], length 0
13:48:14.451713 IP test-shell.59582 > ingress-nginx-controller.ingress-nginx.svc.cluster.local.80: Flags [.], ack 1, win 221, options [nop,nop,TS val 1758652020 ecr 244925152], length 0
13:48:14.452606 IP test-shell.59582 > ingress-nginx-controller.ingress-nginx.svc.cluster.local.80: Flags [P.], seq 1:77, ack 1, win 221, options [nop,nop,TS val 1758652021 ecr 244925152], length 76: HTTP: GET / HTTP/1.1
13:48:14.453066 IP ingress-nginx-controller.ingress-nginx.svc.cluster.local.80 > test-shell.59582: Flags [.], ack 77, win 219, options [nop,nop,TS val 244925153 ecr 1758652021], length 0
13:48:14.453866 IP ingress-nginx-controller.ingress-nginx.svc.cluster.local.80 > test-shell.59582: Flags [P.], seq 1:280, ack 77, win 219, options [nop,nop,TS val 244925154 ecr 1758652021], length 279: HTTP: HTTP/1.1 404 Not Found
13:48:14.453878 IP test-shell.59582 > ingress-nginx-controller.ingress-nginx.svc.cluster.local.80: Flags [.], ack 280, win 229, options [nop,nop,TS val 1758652022 ecr 244925154], length 0
13:48:14.455332 IP test-shell.59582 > ingress-nginx-controller.ingress-nginx.svc.cluster.local.80: Flags [F.], seq 77, ack 280, win 229, options [nop,nop,TS val 1758652023 ecr 244925154], length 0
13:48:14.455600 IP ingress-nginx-controller.ingress-nginx.svc.cluster.local.80 > test-shell.59582: Flags [F.], seq 280, ack 78, win 219, options [nop,nop,TS val 244925156 ecr 1758652023], length 0
13:48:14.455613 IP test-shell.59582 > ingress-nginx-controller.ingress-nginx.svc.cluster.local.80: Flags [.], ack 281, win 229, options [nop,nop,TS val 1758652024 ecr 244925156], length 0
```
